question,answer
what are the faculties at the university of stirling?,"the university of stirling is organized into five faculties, each dedicated to learning, teaching, and research across various disciplines. these faculties include the faculty of arts and humanities, the faculty of health sciences and sport, the faculty of natural sciences, the faculty of social sciences, and the stirling management school."
what is the focus of the faculty of arts and humanities?,the faculty of arts and humanities at the university of stirling is renowned for delivering high-quality courses in arts and humanities. it has earned a reputation for excellence and offers some of the most highly-rated programs in the country.
what distinguishes the faculty of health sciences and sport at the university of stirling?,"the faculty of health sciences and sport is a premier research-intensive education provider for nurses, midwives, health, and sports professionals in scotland. it is committed to excellence in education and research, preparing students for successful careers in healthcare and sports."
what opportunities are available in the faculty of natural sciences at the university of stirling?,"the faculty of natural sciences at the university of stirling offers diverse opportunities for students interested in natural sciences. with highly-rated courses known for their flexibility, practical training, and student satisfaction, the faculty inspires students to make a difference in their chosen fields."
how does the faculty of social sciences at the university of stirling stand out?,"the faculty of social sciences at the university of stirling is a leading institution in the field, with strong rankings across its subject areas. it offers comprehensive programs and resources to support students in their academic and professional pursuits within the social sciences."
what distinguishes the stirling management school at the university of stirling?,"the stirling management school offers a diverse range of globally recognized courses, many of which are accredited by leading industry bodies. with a focus on practical skills and industry relevance, the school prepares students to excel in their chosen careers."
what role does the institute for advanced studies play at the university of stirling?,"the institute for advanced studies supports the university's growing postgraduate research community by providing resources and networking opportunities. it fosters collaboration and innovation among researchers, contributing to the university's research excellence."
