question,answer
what distinguishes the faculty of natural sciences at the university of stirling?,"the faculty of natural sciences has an international reputation for high-quality natural science degrees and groundbreaking research. its courses are highly-rated for their flexibility, practical training, and student satisfaction. many are accredited by leading industry bodies."
what areas of study are covered within the faculty of natural sciences?,"the faculty brings together four areas of study: sustainable food security, biology, people and the environment, mind and behavior. this creates an innovative, cross-disciplinary approach to teaching and research."
what global challenges does the faculty of natural sciences research tackle?,"the faculty's research tackles global challenges in issues such as food security, changing environments, behavior and evolution, digital economies,and biodiversity."
what specialized services does the faculty of natural sciences provide?,"the faculty provides biological, environmental, and scientific consultancy services, as well as specialized business services. additionally,it has a psychology kindergarten providing childcare and a statistics service."
what accolade did the faculty receive in the research excellence framework (ref) 2021?,"the faculty was ranked 1st in the uk for research impact in agriculture, veterinary, and food science,according to the research excellence framework (ref) 2021."
how does the faculty prepare students for careers in natural sciences?,"the faculty's program enables students to link with mentors (alumni and employers) to enhance their knowledge of possible careers,while gaining a greater understanding of businesses and recruitment processes."
what recent news or achievements has the faculty had?,"recent achievements include a study finding that climate change disrupts vital ecosystems in the alps by a university of stirling researcher, and research finding that wild fish consumption can balance nutrient retention in farmed fish."
